{"file_id":"8d5bb7c3-895d-4a81-91b2-9e947d931dc7","text_hash":"97fc649127c25a79b5f15e6c86aeb69bff413f56f4d62b433b9ffa215a9e60b1","od":{"axial_length":"23,73 mm","acd":"2,89","lt":"4,90 mm","cct":"554 μm","wtw":"11,9","k1":"40,95","k2":"43,74","k1_axis":"100","k2_axis":"100","ak":"-2,79 D","source":"Ref: IOLMaster700"},"os":{"axial_length":"23,77 mm","acd":"2,83","lt":"4,95 mm","cct":"544 μm","wtw":"11,6","k1":"41,45","k2":"43,80","k1_axis":"75","k2_axis":"75","ak":"-2,35 D","source":"Ref: IOLMaster700"},"confidence":{"od.axial_length":0.3,"od.acd":0.9,"od.lt":0.7,"od.cct":0.7,"od.wtw":0.9,"od.k1":0.8,"od.k2":0.8,"od.ak":0.7,"od.k1_axis":0.2,"od.k2_axis":0.2,"os.axial_length":0.3,"os.acd":0.9,"os.lt":0.7,"os.cct":0.7,"os.wtw":0.9,"os.k1":0.8,"os.k2":0.8,"os.ak":0.7,"os.k1_axis":0.8,"os.k2_axis":0.8},"flags":["od: axial_length missing","od: lt missing","od: cct missing","os: axial_length missing","os: lt missing","os: cct missing"],"notes":null,"llm_fallback":true,"ocr_text":"ZEISS | Versão de Template 0.1 05/2012 | Copyright 2012 Todos os direitos reservados\nPaciente\nCUNHA, GERALDO JOSE FILIAGI\nData de nascim.\nID de paciente\n17/12/1943\n0391611\nMédico\nSexo\nMasculino\nHCLOE - Hospital de Olhos\nRua Itapeva, 240\nOperador\nAdministrator\n01131240999\nData de verific. da calibr: 01/02/2023\nde:\nData da medição:\n01/02/2023\nn:\nAdministrator\n1,3375\nOD: Cilindro: -2,79 D. Nota: astigmatismo elevado\nOD\ndireita\nLS: Fácico\nRef:\nAnálise\nsac@hcloe.com.br\nhttp://www.hcloe.com.br\nResultado:\nCVD:\nOK\n12,00 mm\nStatus de olho\nVS: Corpo vítreo\nLVC: Não tratado\nVA:\nValores biométricos\nAL: 23,73 mm\nSD:\n20 μm\nWTW: 11,9 mm (!) lx: +0,3 mm\nCCT:\n554 μm\nSD:\n4 μm\nP:\n2,7 mm\nly: +0,0 mm\nCW-Chord: 0,3 mm @ 212°\nACD:\n2,89 mm\nSD:\n10 μm\nLT:\n4,90 mm\nSD:\n20 μm\nSE: 42,30 D\nK1: 40,95 D\nK2: 43,74 D\nAK: -2,79 D\nSD: 0,01 D\nTSE:\n@ 100°\nSD: 0,02 D\nTK1:\n@ 10°\n@ 100°\nSD: 0,01 D\nTK2:\nATK:\nB-Scan\nFixação\nCentral Topography\nCeratometria\nBranco a branco\nLicença inexistente para Central\nTopography\n(!) Valor-limite\nComentário\n(*) Valor editado manualmente\n- nenhum valor medido\nZEISS\nIOLMaster 700\nVersão 1.90.12.05\nGerado em: 01/02/2023 13:20, por Administrator.\nPágina 1 de 1\nZEISS | Versão de Template 0.1 05/2012 | Copyright 2012 Todos os direitos reservados\nPaciente\nCUNHA, GERALDO JOSE FILIAGI\nData de nascim.\nID de paciente\n17/12/1943\n0391611\nMédico\nSexo\nMasculino\nHCLOE - Hospital de Olhos\nRua Itapeva, 240\nOperador\nAdministrator\n01131240999\nData de verific. da calibr: 01/02/2023\nde:\nData da medição:\n01/02/2023\nn:\nAdministrator\n1,3375\nLS: Fácico\nRef:\nsac@hcloe.com.br\nhttp://www.hcloe.com.br\nResultado:\nCVD:\nOK\n12,00 mm\nAnálise\nStatus de olho\nLVC: Não tratado\nOS\nesquerda\nVS: Corpo vítreo\nVA:\nValores biométricos\nAL: 23,77 mm\nSD:\n16 μm\nCCT:\n544 μm\nSD:\n4 μm\nWTW: 11,6 mm (!)\nP: 2,5 mm\nIx: -0,4 mm\nly: +0,0 mm\nCW-Chord: 0,1 mm @ 39°\nACD:\n2,83 mm\nSD:\n11 μm\nLT:\n4,95 mm\nSD: 17 μm\nSE: 42,59 D\nSD: 0,01 D\nTSE:\nK1: 41,45 D\nK2: 43,80 D\nAK: -2,35 D\n@ 75°\nSD: 0,03 D\nTK1:\n@ 165°\nSD: 0,02 D\nTK2:\n@\n75°\nATK:\nB-Scan\nFixação\nCentral Topography\nCeratometria\nBranco a branco\nLicença inexistente para Central\nTopography\n(!) Valor-limite\nComentário\n(*) Valor editado manualmente\n- nenhum valor medido\nZEISS\nIOLMaster 700\nVersão 1.90.12.05\nGerado em: 01/02/2023 13:21, por Administrator.\nPágina 1 de 1"}